{
  "schemaVersion": 1,
  "packageName": "ide-development-managed-core",
  "packageVersion": "2.1.9",
  "installedAt": "2026-08-12T21:16:15Z",
  "files": {
    ".agents/skills/action-queue/SKILL.md": {
      "id": "codex-skill-action-queue",
      "sourceHash": "sha256:32aff5fd66bfe8d724377ded1a278b54258c07c3cb567a1a4369589d499f6ac2",
      "contentHash": "sha256:32aff5fd66bfe8d724377ded1a278b54258c07c3cb567a1a4369589d499f6ac2",
      "mode": "0644"
    },
    ".agents/skills/agentcomply/SKILL.md": {
      "id": "codex-skill-agentcomply",
      "sourceHash": "sha256:8b7d58d9f8e475f6c6fb79f5bcaf89b6f98e6ab1305042eefdd484840b479601",
      "contentHash": "sha256:8b7d58d9f8e475f6c6fb79f5bcaf89b6f98e6ab1305042eefdd484840b479601",
      "mode": "0644"
    },
    ".agents/skills/agentsetup/SKILL.md": {
      "id": "codex-skill-agentsetup",
      "sourceHash": "sha256:58ed27eec8580172882dcf1223324ea792c534a3aa26c5cd0d072f6aa8451307",
      "contentHash": "sha256:58ed27eec8580172882dcf1223324ea792c534a3aa26c5cd0d072f6aa8451307",
      "mode": "0644"
    },
    ".agents/skills/api-patterns/SKILL.md": {
      "id": "codex-skill-api-patterns",
      "sourceHash": "sha256:f819bbb51d4d8a32a1621085d0931c8cc4c63f581d9ac0507e88af7eb81f4a05",
      "contentHash": "sha256:f819bbb51d4d8a32a1621085d0931c8cc4c63f581d9ac0507e88af7eb81f4a05",
      "mode": "0644"
    },
    ".agents/skills/app-builder/SKILL.md": {
      "id": "codex-skill-app-builder",
      "sourceHash": "sha256:88bf10494963cc68ecaf7ca532020e45d843516557089f2c48cfe319d051a555",
      "contentHash": "sha256:88bf10494963cc68ecaf7ca532020e45d843516557089f2c48cfe319d051a555",
      "mode": "0644"
    },
    ".agents/skills/architecture/SKILL.md": {
      "id": "codex-skill-architecture",
      "sourceHash": "sha256:d9934b0c38d5f67d2018a4b452e3f3f1faed29150996ca064406e29bcc767bc0",
      "contentHash": "sha256:d9934b0c38d5f67d2018a4b452e3f3f1faed29150996ca064406e29bcc767bc0",
      "mode": "0644"
    },
    ".agents/skills/bash-linux/SKILL.md": {
      "id": "codex-skill-bash-linux",
      "sourceHash": "sha256:86e46e58c1a561ced5fd8e5ae0300cd50a9866ec7213f840d8eb097e91ce0d60",
      "contentHash": "sha256:86e46e58c1a561ced5fd8e5ae0300cd50a9866ec7213f840d8eb097e91ce0d60",
      "mode": "0644"
    },
    ".agents/skills/ci-cd-and-automation/SKILL.md": {
      "id": "codex-skill-ci-cd-and-automation",
      "sourceHash": "sha256:b8b8c95f16acfd71e8ce12004d395ae1b8cf598343edcbabd3bba8eaa8586e3f",
      "contentHash": "sha256:b8b8c95f16acfd71e8ce12004d395ae1b8cf598343edcbabd3bba8eaa8586e3f",
      "mode": "0644"
    },
    ".agents/skills/code-review-and-quality/SKILL.md": {
      "id": "codex-skill-code-review-and-quality",
      "sourceHash": "sha256:88413831483002f87b2a09d4f5abec73cdbdaeb20084a35ea58eac50b6555f91",
      "contentHash": "sha256:88413831483002f87b2a09d4f5abec73cdbdaeb20084a35ea58eac50b6555f91",
      "mode": "0644"
    },
    ".agents/skills/code-simplification/SKILL.md": {
      "id": "codex-skill-code-simplification",
      "sourceHash": "sha256:5d904fa246d06c962703618d92d8941239546a0febe6079a281f79f98a8043b8",
      "contentHash": "sha256:5d904fa246d06c962703618d92d8941239546a0febe6079a281f79f98a8043b8",
      "mode": "0644"
    },
    ".agents/skills/context-engineering/SKILL.md": {
      "id": "codex-skill-context-engineering",
      "sourceHash": "sha256:b2002e82a3e2eeb6e751c278fa46cf32ce8b049777939b78c4dbf955ef822869",
      "contentHash": "sha256:b2002e82a3e2eeb6e751c278fa46cf32ce8b049777939b78c4dbf955ef822869",
      "mode": "0644"
    },
    ".agents/skills/data-table/SKILL.md": {
      "id": "codex-skill-data-table",
      "sourceHash": "sha256:800a8f2e1483ba4c5bc82c76dd4e194c15772e28585fb8a59d4ec77bb2e90857",
      "contentHash": "sha256:800a8f2e1483ba4c5bc82c76dd4e194c15772e28585fb8a59d4ec77bb2e90857",
      "mode": "0644"
    },
    ".agents/skills/database-design/SKILL.md": {
      "id": "codex-skill-database-design",
      "sourceHash": "sha256:845fbafe70e56e76de946b123d981cd67f97c97b51a8ff7f5d560d804db60b08",
      "contentHash": "sha256:845fbafe70e56e76de946b123d981cd67f97c97b51a8ff7f5d560d804db60b08",
      "mode": "0644"
    },
    ".agents/skills/deployment-procedures/SKILL.md": {
      "id": "codex-skill-deployment-procedures",
      "sourceHash": "sha256:c60479dc3f85a8f67505bd433d59833bd8906033231cc4f57ace1392f6ae5171",
      "contentHash": "sha256:c60479dc3f85a8f67505bd433d59833bd8906033231cc4f57ace1392f6ae5171",
      "mode": "0644"
    },
    ".agents/skills/deprecation-and-migration/SKILL.md": {
      "id": "codex-skill-deprecation-and-migration",
      "sourceHash": "sha256:65b7fbca07a60c6632e83bfa6bd2ce1d0cad051da23d3ec6640d316396c83207",
      "contentHash": "sha256:65b7fbca07a60c6632e83bfa6bd2ce1d0cad051da23d3ec6640d316396c83207",
      "mode": "0644"
    },
    ".agents/skills/documentation-and-adrs/SKILL.md": {
      "id": "codex-skill-documentation-and-adrs",
      "sourceHash": "sha256:d604210ca058350c9b25643fc5ddfcbd71ed1771e5f6f6d50acb74b21a9e57af",
      "contentHash": "sha256:d604210ca058350c9b25643fc5ddfcbd71ed1771e5f6f6d50acb74b21a9e57af",
      "mode": "0644"
    },
    ".agents/skills/frontend-ui-engineering/SKILL.md": {
      "id": "codex-skill-frontend-ui-engineering",
      "sourceHash": "sha256:a54588d8d901f0fb6fdf3d5220c5286f45c68e4c12d94909822856e9bd895d8a",
      "contentHash": "sha256:a54588d8d901f0fb6fdf3d5220c5286f45c68e4c12d94909822856e9bd895d8a",
      "mode": "0644"
    },
    ".agents/skills/git-safeguard/SKILL.md": {
      "id": "codex-skill-git-safeguard",
      "sourceHash": "sha256:54309e7a843917890103cee609e36ab5cf9b1d6e0424d2dd0d124637e8eefe86",
      "contentHash": "sha256:54309e7a843917890103cee609e36ab5cf9b1d6e0424d2dd0d124637e8eefe86",
      "mode": "0644"
    },
    ".agents/skills/i18n-localization/SKILL.md": {
      "id": "codex-skill-i18n-localization",
      "sourceHash": "sha256:9ae1a55d015d65cbb45b4a89a0afbe586a9b9b4cec94454959db2657e55b5c31",
      "contentHash": "sha256:9ae1a55d015d65cbb45b4a89a0afbe586a9b9b4cec94454959db2657e55b5c31",
      "mode": "0644"
    },
    ".agents/skills/incremental-implementation/SKILL.md": {
      "id": "codex-skill-incremental-implementation",
      "sourceHash": "sha256:ec316b4b0042bce9cc514e69a3bd412d4e40010c5bfe160448cb36635d6617a7",
      "contentHash": "sha256:ec316b4b0042bce9cc514e69a3bd412d4e40010c5bfe160448cb36635d6617a7",
      "mode": "0644"
    },
    ".agents/skills/intelligent-routing/SKILL.md": {
      "id": "codex-skill-intelligent-routing",
      "sourceHash": "sha256:90fa5436668f24629df801ceadaed67bf3fb7fa1eda28bfd01e258dbeb1e7dba",
      "contentHash": "sha256:90fa5436668f24629df801ceadaed67bf3fb7fa1eda28bfd01e258dbeb1e7dba",
      "mode": "0644"
    },
    ".agents/skills/lint-and-validate/SKILL.md": {
      "id": "codex-skill-lint-and-validate",
      "sourceHash": "sha256:b7f622ed24a11aaec2cfd89e4262b1990344ab778ef1e3901989897dca299778",
      "contentHash": "sha256:b7f622ed24a11aaec2cfd89e4262b1990344ab778ef1e3901989897dca299778",
      "mode": "0644"
    },
    ".agents/skills/mcp-builder/SKILL.md": {
      "id": "codex-skill-mcp-builder",
      "sourceHash": "sha256:837ec7585cd549f9dc1ccd99f5665a7e6b51306d0e4ac81061fba43bdb82a9b9",
      "contentHash": "sha256:837ec7585cd549f9dc1ccd99f5665a7e6b51306d0e4ac81061fba43bdb82a9b9",
      "mode": "0644"
    },
    ".agents/skills/mobile-design/SKILL.md": {
      "id": "codex-skill-mobile-design",
      "sourceHash": "sha256:eff13cba214b7dd00b7bfee52a347bc4d0d6cea1d6ba5adace75f7e4ae0067b0",
      "contentHash": "sha256:eff13cba214b7dd00b7bfee52a347bc4d0d6cea1d6ba5adace75f7e4ae0067b0",
      "mode": "0644"
    },
    ".agents/skills/model-routing/SKILL.md": {
      "id": "codex-skill-model-routing",
      "sourceHash": "sha256:b11c34346a463a025d95a2cdc15d7e4f997dff1007cdf6dd4e2afd0bbc0037a1",
      "contentHash": "sha256:b11c34346a463a025d95a2cdc15d7e4f997dff1007cdf6dd4e2afd0bbc0037a1",
      "mode": "0644"
    },
    ".agents/skills/nodejs-best-practices/SKILL.md": {
      "id": "codex-skill-nodejs-best-practices",
      "sourceHash": "sha256:d2f143d35a22847843857479502d93d62036a5e1002f797f9a79c82e0bf6b21c",
      "contentHash": "sha256:d2f143d35a22847843857479502d93d62036a5e1002f797f9a79c82e0bf6b21c",
      "mode": "0644"
    },
    ".agents/skills/observability-and-instrumentation/SKILL.md": {
      "id": "codex-skill-observability-and-instrumentation",
      "sourceHash": "sha256:d13f7024b230ba3012e212860c34a5d235230b64ba2148089505040d8e00e576",
      "contentHash": "sha256:d13f7024b230ba3012e212860c34a5d235230b64ba2148089505040d8e00e576",
      "mode": "0644"
    },
    ".agents/skills/parallel-agents/SKILL.md": {
      "id": "codex-skill-parallel-agents",
      "sourceHash": "sha256:028f348befe22ddc9bac8574a85632b9973af661d716ccfb47432c99a7168ab0",
      "contentHash": "sha256:028f348befe22ddc9bac8574a85632b9973af661d716ccfb47432c99a7168ab0",
      "mode": "0644"
    },
    ".agents/skills/performance-optimization/SKILL.md": {
      "id": "codex-skill-performance-optimization",
      "sourceHash": "sha256:c4846094d378126337eca2ee26c46f22f685e305cfefe0b5f10f43f7780f99b5",
      "contentHash": "sha256:c4846094d378126337eca2ee26c46f22f685e305cfefe0b5f10f43f7780f99b5",
      "mode": "0644"
    },
    ".agents/skills/persistent-qa/SKILL.md": {
      "id": "codex-skill-persistent-qa",
      "sourceHash": "sha256:03087bf817616a7bfbb5eedbc48cad93cd44f2fd75fafc3efbeb9f79074cac9c",
      "contentHash": "sha256:03087bf817616a7bfbb5eedbc48cad93cd44f2fd75fafc3efbeb9f79074cac9c",
      "mode": "0644"
    },
    ".agents/skills/personal-information-forms/SKILL.md": {
      "id": "codex-skill-personal-information-forms",
      "sourceHash": "sha256:44b1b2d94de4b9b467aa2dc688320ae76fdef461438785a32e50cdd70250c325",
      "contentHash": "sha256:44b1b2d94de4b9b467aa2dc688320ae76fdef461438785a32e50cdd70250c325",
      "mode": "0644"
    },
    ".agents/skills/powershell-windows/SKILL.md": {